{
  "id": "review-1",
  "unitId": "review-1",
  "title": "Units 1-3 Review",
  "description": "A cumulative test covering word formation, phrasal verbs, sentence transformation, past tenses, and sentence matching from Units 1, 2 and 3.",
  "passingScore": 70,
  "contentLocale": "en",
  "attemptSettings": {
    "allowRetry": true,
    "showCorrectAnswer": "after-submit",
    "showExplanation": "after-submit",
    "saveProgress": true
  },
  "sections": [
    {
      "id": "word-formation",
      "type": "fill-in-the-blanks",
      "title": "Word formation",
      "instructions": "Use the word given in capitals to form a word that fits each gap.",
      "selectionMode": "fixed",
      "shuffleQuestions": false,
      "questionIds": ["review-1-word-formation-fitb-0001"]
    },
    {
      "id": "phrasal-verbs",
      "type": "short-answer",
      "title": "Phrasal verbs",
      "instructions": "Complete using the correct form of the verbs in the box.",
      "selectionMode": "fixed",
      "shuffleQuestions": true,
      "questionIds": [
        "review-1-phrasal-verbs-short-0001",
        "review-1-phrasal-verbs-short-0002",
        "review-1-phrasal-verbs-short-0003",
        "review-1-phrasal-verbs-short-0004",
        "review-1-phrasal-verbs-short-0005",
        "review-1-phrasal-verbs-short-0006",
        "review-1-phrasal-verbs-short-0007",
        "review-1-phrasal-verbs-short-0008"
      ]
    },
    {
      "id": "sentence-transformation",
      "type": "short-answer",
      "title": "Sentence transformation",
      "instructions": "Complete the second sentence using the word given, so it means the same as the first.",
      "selectionMode": "fixed",
      "shuffleQuestions": true,
      "questionIds": [
        "review-1-sentence-transformation-short-0001",
        "review-1-sentence-transformation-short-0002",
        "review-1-sentence-transformation-short-0003",
        "review-1-sentence-transformation-short-0004",
        "review-1-sentence-transformation-short-0005",
        "review-1-sentence-transformation-short-0006",
        "review-1-sentence-transformation-short-0007",
        "review-1-sentence-transformation-short-0008",
        "review-1-sentence-transformation-short-0009",
        "review-1-sentence-transformation-short-0010"
      ]
    },
    {
      "id": "grammar-tenses",
      "type": "multiple-choice",
      "title": "Multiple choice",
      "instructions": "Choose the correct answer.",
      "selectionMode": "fixed",
      "shuffleQuestions": true,
      "shuffleOptions": true,
      "questionIds": [
        "review-1-grammar-tenses-mcq-0001",
        "review-1-grammar-tenses-mcq-0002",
        "review-1-grammar-tenses-mcq-0003",
        "review-1-grammar-tenses-mcq-0004",
        "review-1-grammar-tenses-mcq-0005",
        "review-1-grammar-tenses-mcq-0006",
        "review-1-grammar-tenses-mcq-0007",
        "review-1-grammar-tenses-mcq-0008"
      ]
    },
    {
      "id": "sentence-matching",
      "type": "matching",
      "title": "Sentence matching",
      "instructions": "Match the two halves of the sentences.",
      "selectionMode": "fixed",
      "shuffleQuestions": false,
      "questionIds": ["review-1-sentence-matching-match-0001"]
    }
  ]
}
