{
  "id": "unit-2-review",
  "unitId": "unit-2",
  "title": "Unit 2 Review",
  "description": "Review the past simple, past continuous, and used to.",
  "passingScore": 70,
  "contentLocale": "en",
  "attemptSettings": {
    "allowRetry": true,
    "showCorrectAnswer": "after-submit",
    "showExplanation": "after-submit",
    "saveProgress": true
  },
  "sections": [
    {
      "id": "multiple-choice",
      "type": "multiple-choice",
      "title": "Multiple choice",
      "instructions": "Choose the correct answer.",
      "selectionMode": "fixed",
      "shuffleQuestions": true,
      "shuffleOptions": true,
      "questionIds": [
        "unit-2-past-simple-mcq-0001",
        "unit-2-past-simple-mcq-0002",
        "unit-2-past-simple-mcq-0003",
        "unit-2-past-simple-mcq-0004",
        "unit-2-past-continuous-mcq-0001",
        "unit-2-past-continuous-mcq-0002",
        "unit-2-past-continuous-mcq-0003",
        "unit-2-past-continuous-mcq-0004",
        "unit-2-past-continuous-mcq-0005",
        "unit-2-used-to-mcq-0001"
      ]
    },
    {
      "id": "short-answer",
      "type": "short-answer",
      "title": "Short answer",
      "instructions": "Complete each sentence with the correct form of the verb in brackets.",
      "selectionMode": "fixed",
      "shuffleQuestions": true,
      "questionIds": [
        "unit-2-past-simple-short-0001",
        "unit-2-past-simple-short-0002",
        "unit-2-past-simple-short-0003",
        "unit-2-past-simple-short-0004",
        "unit-2-past-continuous-short-0001",
        "unit-2-past-continuous-short-0002",
        "unit-2-past-continuous-short-0003",
        "unit-2-used-to-short-0001"
      ]
    },
    {
      "id": "true-false",
      "type": "true-false",
      "title": "True or false",
      "instructions": "Decide whether each statement is true or false.",
      "selectionMode": "fixed",
      "shuffleQuestions": true,
      "questionIds": [
        "unit-2-past-simple-tf-0001",
        "unit-2-past-continuous-tf-0001",
        "unit-2-past-continuous-tf-0002",
        "unit-2-past-continuous-tf-0003",
        "unit-2-used-to-tf-0001",
        "unit-2-used-to-tf-0002"
      ]
    },
    {
      "id": "mixed-practice",
      "type": "mixed",
      "title": "Mixed practice",
      "instructions": "Complete all questions.",
      "selectionMode": "random",
      "questionCount": 6,
      "questionFilter": {
        "unitIds": ["unit-2"],
        "topicIds": ["past-simple", "past-continuous", "used-to"],
        "types": ["multiple-choice", "short-answer", "true-false"],
        "difficulties": ["easy", "medium"],
        "status": ["published"]
      },
      "distribution": {
        "multiple-choice": 2,
        "short-answer": 2,
        "true-false": 2
      },
      "shuffleQuestions": true,
      "avoidRecentlyAnswered": true
    }
  ]
}
